{
  "verdict": "pass",
  "overall_score": 84,
  "summary": "Strong comparison with a clear conclusion, though it still needs broader sourcing for a top-tier benchmark score.",
  "criteria": [
    { "name": "task_completion", "score": 17, "max_score": 20, "reasoning": "All three protocols are covered." },
    { "name": "factual_precision", "score": 16, "max_score": 20, "reasoning": "Mostly precise." },
    { "name": "citation_grounding", "score": 12, "max_score": 15, "reasoning": "Some important claims could cite more evidence." },
    { "name": "source_diversity", "score": 11, "max_score": 15, "reasoning": "Only a few source domains are represented." },
    { "name": "analytical_depth", "score": 18, "max_score": 20, "reasoning": "Strong comparative analysis." },
    { "name": "uncertainty_calibration", "score": 10, "max_score": 10, "reasoning": "Reasonable caveats are present." }
  ]
}
